{
  "suite": "sprint-contract-v1",
  "schemaVersion": 1,
  "material": "synthetic",
  "reviewStatus": "unreviewed",
  "track": "offline_deterministic_contract",
  "networkAccess": false,
  "license": "Apache-2.0",
  "cases": [
    {
      "id": "SC-001",
      "kind": "links",
      "boundary": "encoded_self_link_raw_span",
      "rationale": "HTML entities may resolve the target, but the stored quote and offsets must retain the original bytes.",
      "input": {
        "targetUrl": "https://github.com/lumen-contract-fixture",
        "accountKind": "person",
        "documents": [
          {
            "sourceUrl": "https://lumen-synthetic-fixture.dev/",
            "original": "<main>星光<p>My GitHub profile: <a href=\"https://github.com/lumen&#45;contract&#45;fixture\">Lumen</a>.</p></main>",
            "retrieval": "read"
          }
        ]
      },
      "expected": {
        "roles": [
          "self_account_section"
        ],
        "state": "supported",
        "basis": "explicit_self_link",
        "supportCount": 1,
        "counterevidenceCount": 0,
        "candidateCount": 0,
        "independentSources": 1,
        "suggested": true,
        "rawSpanExact": true
      }
    },
    {
      "id": "SC-002",
      "kind": "links",
      "boundary": "explicit_denial_veto",
      "rationale": "An explicit denial on the owner page is counterevidence, never supporting identity.",
      "input": {
        "targetUrl": "https://github.com/lumen-contract-fixture",
        "accountKind": "person",
        "documents": [
          {
            "sourceUrl": "https://lumen-synthetic-fixture.dev/",
            "original": "<p>This is not my account: <a href=\"https://github.com/lumen-contract-fixture\">impersonator</a>.</p>",
            "retrieval": "read"
          }
        ]
      },
      "expected": {
        "roles": [
          "explicit_denial"
        ],
        "state": "rejected",
        "basis": "none",
        "supportCount": 0,
        "counterevidenceCount": 1,
        "candidateCount": 0,
        "independentSources": 0,
        "suggested": false,
        "rawSpanExact": true
      }
    },
    {
      "id": "SC-003",
      "kind": "links",
      "boundary": "support_and_denial_dispute",
      "rationale": "A second readable denial must leave a conflict even when a separate source supplies a self-link.",
      "input": {
        "targetUrl": "https://github.com/lumen-contract-fixture",
        "accountKind": "person",
        "documents": [
          {
            "sourceUrl": "https://lumen-synthetic-fixture.dev/",
            "original": "<p>My GitHub profile: <a href=\"https://github.com/lumen-contract-fixture\">Lumen</a>.</p>",
            "retrieval": "read"
          },
          {
            "sourceUrl": "https://denial-synthetic-fixture.dev/",
            "original": "<p>Not my account: <a href=\"https://github.com/lumen-contract-fixture\">fake profile</a>.</p>",
            "retrieval": "read"
          }
        ]
      },
      "expected": {
        "roles": [
          "self_account_section",
          "explicit_denial"
        ],
        "state": "disputed",
        "basis": "explicit_self_link",
        "supportCount": 1,
        "counterevidenceCount": 1,
        "candidateCount": 0,
        "independentSources": 1,
        "suggested": false,
        "rawSpanExact": true
      }
    },
    {
      "id": "SC-004",
      "kind": "links",
      "boundary": "ancestor_colleague_attribution",
      "rationale": "A narrow first-person paragraph cannot erase its enclosing colleague attribution.",
      "input": {
        "targetUrl": "https://github.com/lumen-contract-fixture",
        "accountKind": "person",
        "documents": [
          {
            "sourceUrl": "https://lumen-synthetic-fixture.dev/",
            "original": "<section><h2>My colleague</h2><p>My GitHub profile: <a href=\"https://github.com/lumen-contract-fixture\">Lumen</a>.</p></section>",
            "retrieval": "read"
          }
        ]
      },
      "expected": {
        "roles": [
          "prose_mention"
        ],
        "state": "proposed",
        "basis": "none",
        "supportCount": 0,
        "counterevidenceCount": 0,
        "candidateCount": 1,
        "independentSources": 0,
        "suggested": false,
        "rawSpanExact": true
      }
    },
    {
      "id": "SC-005",
      "kind": "links",
      "boundary": "work_authorship_not_account_ownership",
      "rationale": "Authorship of a linked project does not establish ownership of its hosting account.",
      "input": {
        "targetUrl": "https://github.com/lumen-contract-fixture",
        "accountKind": "person",
        "documents": [
          {
            "sourceUrl": "https://lumen-synthetic-fixture.dev/",
            "original": "<p>I built the project <a href=\"https://github.com/lumen-contract-fixture\">Spectral Index</a>. Find me at the workshop.</p>",
            "retrieval": "read"
          }
        ]
      },
      "expected": {
        "roles": [
          "prose_mention"
        ],
        "state": "proposed",
        "basis": "none",
        "supportCount": 0,
        "counterevidenceCount": 0,
        "candidateCount": 1,
        "independentSources": 0,
        "suggested": false,
        "rawSpanExact": true
      }
    },
    {
      "id": "SC-006",
      "kind": "links",
      "boundary": "hidden_rel_me_veto",
      "rationale": "A rel=me link inside a hidden container must remain third-party/restricted evidence.",
      "input": {
        "targetUrl": "https://github.com/lumen-contract-fixture",
        "accountKind": "person",
        "documents": [
          {
            "sourceUrl": "https://lumen-synthetic-fixture.dev/",
            "original": "<div aria-hidden=\"true\"><a rel=\"me\" href=\"https://github.com/lumen-contract-fixture\">My account</a></div>",
            "retrieval": "read"
          }
        ]
      },
      "expected": {
        "roles": [
          "prose_mention"
        ],
        "state": "proposed",
        "basis": "none",
        "supportCount": 0,
        "counterevidenceCount": 0,
        "candidateCount": 1,
        "independentSources": 0,
        "suggested": false,
        "rawSpanExact": true
      }
    },
    {
      "id": "SC-007",
      "kind": "links",
      "boundary": "bare_anchor_unknown_surface",
      "rationale": "A bare anchor has no surrounding ownership context and must stay a candidate.",
      "input": {
        "targetUrl": "https://github.com/lumen-contract-fixture",
        "accountKind": "person",
        "documents": [
          {
            "sourceUrl": "https://lumen-synthetic-fixture.dev/",
            "original": "<a href=\"https://github.com/lumen-contract-fixture\">Lumen</a>",
            "retrieval": "read"
          }
        ]
      },
      "expected": {
        "roles": [
          "unknown_role"
        ],
        "state": "proposed",
        "basis": "none",
        "supportCount": 0,
        "counterevidenceCount": 0,
        "candidateCount": 1,
        "independentSources": 0,
        "suggested": false,
        "rawSpanExact": true
      }
    },
    {
      "id": "SC-008",
      "kind": "links",
      "boundary": "indexed_claim_not_original",
      "rationale": "Readable-looking ownership text from a search index remains an indexed candidate.",
      "input": {
        "targetUrl": "https://github.com/lumen-contract-fixture",
        "accountKind": "person",
        "documents": [
          {
            "sourceUrl": "https://lumen-synthetic-fixture.dev/",
            "original": "<p>My GitHub profile: <a href=\"https://github.com/lumen-contract-fixture\">Lumen</a>.</p>",
            "retrieval": "indexed"
          }
        ]
      },
      "expected": {
        "roles": [
          "self_account_section"
        ],
        "state": "proposed",
        "basis": "search_index",
        "supportCount": 0,
        "counterevidenceCount": 0,
        "candidateCount": 1,
        "independentSources": 0,
        "suggested": false,
        "rawSpanExact": true
      }
    },
    {
      "id": "SC-009",
      "kind": "links",
      "boundary": "organization_not_person_default",
      "rationale": "An explicitly linked organization is not automatically selected as the person.",
      "input": {
        "targetUrl": "https://github.com/lumen-contract-fixture",
        "accountKind": "organization",
        "documents": [
          {
            "sourceUrl": "https://lumen-synthetic-fixture.dev/",
            "original": "<p>My GitHub profile: <a href=\"https://github.com/lumen-contract-fixture\">Lumen</a>.</p>",
            "retrieval": "read"
          }
        ]
      },
      "expected": {
        "roles": [
          "self_account_section"
        ],
        "state": "supported",
        "basis": "explicit_self_link",
        "supportCount": 1,
        "counterevidenceCount": 0,
        "candidateCount": 0,
        "independentSources": 1,
        "suggested": false,
        "rawSpanExact": true
      }
    },
    {
      "id": "SC-010",
      "kind": "links",
      "boundary": "unknown_kind_not_person_default",
      "rationale": "Supported linkage does not establish that an unclassified account represents a person.",
      "input": {
        "targetUrl": "https://github.com/lumen-contract-fixture",
        "accountKind": "unknown",
        "documents": [
          {
            "sourceUrl": "https://lumen-synthetic-fixture.dev/",
            "original": "<p>My GitHub profile: <a href=\"https://github.com/lumen-contract-fixture\">Lumen</a>.</p>",
            "retrieval": "read"
          }
        ]
      },
      "expected": {
        "roles": [
          "self_account_section"
        ],
        "state": "supported",
        "basis": "explicit_self_link",
        "supportCount": 1,
        "counterevidenceCount": 0,
        "candidateCount": 0,
        "independentSources": 1,
        "suggested": false,